<?xml version="1.0" encoding="UTF-8"?>
<!--Sample XML file generated by XMLSpy v2021 rel. 3 (x64) (http://www.altova.com)-->
<cim:RequestWholesaleSettlement_MarketDocument xmlns:xsi="http://www.w3.org/2001/XMLSchema-instance" xmlns:cim="urn:ediel.org:measure:requestwholesalesettlement:0:1" xsi:schemaLocation="urn:ediel.org:measure:requestwholesalesettlement:0:1 urn-ediel-org-measure-requestwholesalesettlement-0-1.xsd">
    <cim:mRID>12345678</cim:mRID>
    <cim:type>D21</cim:type>
    <cim:process.processType>D05</cim:process.processType>
    <cim:businessSector.type>23</cim:businessSector.type>
    <cim:sender_MarketParticipant.mRID codingScheme="A10">5799999933318</cim:sender_MarketParticipant.mRID>
    <cim:sender_MarketParticipant.marketRole.type>DDQ</cim:sender_MarketParticipant.marketRole.type>
    <cim:receiver_MarketParticipant.mRID codingScheme="A10">5790001330552</cim:receiver_MarketParticipant.mRID>
    <cim:receiver_MarketParticipant.marketRole.type>DDZ</cim:receiver_MarketParticipant.marketRole.type> <!--ROLE uklar -->
    <cim:createdDateTime>2022-12-17T09:30:47Z</cim:createdDateTime>
    <cim:Series>
        <cim:mRID>25836143</cim:mRID>
        <cim:settlement_Series.version>D01</cim:settlement_Series.version>
        <cim:start_DateAndOrTime.dateTime>2022-08-17T22:00:00Z</cim:start_DateAndOrTime.dateTime>
        <cim:end_DateAndOrTime.dateTime>2022-08-31T22:00:00Z</cim:end_DateAndOrTime.dateTime>
        <cim:meteringGridArea_Domain.mRID codingScheme="NDK">244</cim:meteringGridArea_Domain.mRID>
        <cim:energySupplier_MarketParticipant.mRID codingScheme="A10">5799999933318</cim:energySupplier_MarketParticipant.mRID>
        <cim:chargeTypeOwner_MarketParticipant.mRID codingScheme="A10">570001110111</cim:chargeTypeOwner_MarketParticipant.mRID>
        <cim:aggregationSeries_Period.resolution>PT1M</cim:aggregationSeries_Period.resolution> <!-- kun i forbindelse med BRS-030 -->
        <cim:ChargeType>
            <cim:type>D03</cim:type>
            <cim:mRID>EA-001</cim:mRID>
        </cim:ChargeType>        
        <cim:ChargeType>
            <cim:type>D02</cim:type>
            <cim:mRID>EA-002</cim:mRID>
        </cim:ChargeType>
    </cim:Series>
</cim:RequestWholesaleSettlement_MarketDocument>

