<?xml version="1.0" encoding="UTF-8"?>
<!--Sample XML file generated by XMLSpy v2021 rel. 3 (x64) (http://www.altova.com)-->
<cim:RequestWholesaleSettlement_MarketDocument xmlns:xsi="http://www.w3.org/2001/XMLSchema-instance" xmlns:cim="urn:ediel.org:measure:requestwholesalesettlement:0:1" xsi:schemaLocation="urn:ediel.org:measure:requestwholesalesettlement:0:1 urn-ediel-org-measure-requestwholesalesettlement-0-1.xsd">
    <cim:mRID>{MessageId}</cim:mRID>
    <cim:type>D21</cim:type>
    <cim:process.processType>D05</cim:process.processType>
    <cim:businessSector.type>23</cim:businessSector.type>
    <cim:sender_MarketParticipant.mRID codingScheme="A10">{ActorNumber}</cim:sender_MarketParticipant.mRID>
    <cim:sender_MarketParticipant.marketRole.type>{ActorRole}</cim:sender_MarketParticipant.marketRole.type>
    <cim:receiver_MarketParticipant.mRID codingScheme="A10">5790001330552</cim:receiver_MarketParticipant.mRID>
    <cim:receiver_MarketParticipant.marketRole.type>DGL</cim:receiver_MarketParticipant.marketRole.type>
    <cim:createdDateTime>2022-02-17T09:30:47Z</cim:createdDateTime>
    <cim:Series>
        <cim:mRID>{TransactionId}</cim:mRID>
        <!--cim:settlement_Series.version>D01</cim:settlement_Series.version-->
        <cim:start_DateAndOrTime.dateTime>2021-12-31T23:00:00Z</cim:start_DateAndOrTime.dateTime>
        <cim:end_DateAndOrTime.dateTime>2022-01-31T23:00:00Z</cim:end_DateAndOrTime.dateTime>
<!--        <cim:meteringGridArea_Domain.mRID codingScheme="NDK">543</cim:meteringGridArea_Domain.mRID>-->
        <cim:energySupplier_MarketParticipant.mRID codingScheme="A10">{ActorNumber}</cim:energySupplier_MarketParticipant.mRID>
<!--        <cim:chargeTypeOwner_MarketParticipant.mRID codingScheme="A10">5790000432752</cim:chargeTypeOwner_MarketParticipant.mRID>-->
<!--        <cim:ChargeType>-->
<!--            <cim:type>D03</cim:type>-->
<!--            <cim:mRID>42000</cim:mRID>-->
<!--        </cim:ChargeType>-->
    </cim:Series>
</cim:RequestWholesaleSettlement_MarketDocument>

